{
  "item_id": "cctc-2088",
  "schema_version": 1,
  "generated_at": "2026-06-20",
  "index_sources": {
    "cupples": {
      "filename": "cupples-core-curriculum-2e.pdf",
      "page_count": 1083
    }
  },
  "primary_anchor": {
    "source_id": "cupples",
    "pdf_page": 98,
    "keywords": [
      "Biopsies",
      "performed",
      "based",
      "patient",
      "history",
      "physical",
      "examination",
      "malignant"
    ],
    "keyword_hash": "sha256:6c8591c9791c962474d4590bb402f5ad165c9b3ef244a306e7f54589f603999f"
  },
  "references": [
    {
      "ref_index": 0,
      "source_id": "cupples",
      "pdf_page": 98,
      "keywords": [
        "biopsies",
        "history",
        "physical-driven",
        "evaluation",
        "confirm",
        "disease",
        "malignancy"
      ],
      "keyword_hash": "sha256:6c9573e4b90151fee90c62c329dbe6f7995d88dd285c970e80da92c5665d94a1"
    }
  ]
}
