{
  "item_id": "cctc-1078",
  "schema_version": 1,
  "generated_at": "2026-06-20",
  "index_sources": {
    "cupples": {
      "filename": "cupples-core-curriculum-2e.pdf",
      "page_count": 1083
    }
  },
  "primary_anchor": {
    "source_id": "cupples",
    "pdf_page": 340,
    "keywords": [
      "federal",
      "crime",
      "donate",
      "human",
      "organ",
      "value",
      "cash",
      "property"
    ],
    "keyword_hash": "sha256:53d0aa2419bc95323bc690770c2b55180e26de5648f2c784cd33252905ca8ecc"
  },
  "references": [
    {
      "ref_index": 0,
      "source_id": "cupples",
      "pdf_page": 340,
      "keywords": [
        "federal",
        "crime",
        "offer",
        "organ",
        "anything",
        "value"
      ],
      "keyword_hash": "sha256:c100f53bc0f7ada9fa33e54edec802fca7639e84c12673e83378c5de855ba9a8"
    }
  ]
}
