{
  "item_id": "cctc-1166",
  "schema_version": 1,
  "generated_at": "2026-06-20",
  "index_sources": {
    "cupples": {
      "filename": "cupples-core-curriculum-2e.pdf",
      "page_count": 1083
    }
  },
  "primary_anchor": {
    "source_id": "cupples",
    "pdf_page": 115,
    "keywords": [
      "Before",
      "after",
      "eating",
      "Wash",
      "hands",
      "meals"
    ],
    "keyword_hash": "sha256:fdc96fd10339d08b52f2211c7e11d44a813aaf1326574fb3707f40d955153f9c"
  },
  "references": [
    {
      "ref_index": 0,
      "source_id": "cupples",
      "pdf_page": 115,
      "keywords": [
        "hygiene",
        "hands",
        "before",
        "after",
        "eating"
      ],
      "keyword_hash": "sha256:35f574de859b2dc55cfba767993e6077659cd755d7ebc46ecef5fd7defee31a7"
    }
  ]
}
